{
  "schemaVersion": "jovra.observation/1",
  "projectId": "sample-court-day",
  "sample": true,
  "eventRevision": 3,
  "observationId": "obs-03",
  "kind": "bounce",
  "sourceId": "camera-1",
  "sourceTime": {
    "startUs": 1218200000,
    "endUs": 1218216667
  },
  "sessionTimeUs": null,
  "syncRevision": null,
  "eventRef": "p-041",
  "capabilityId": "court.bounceLocation",
  "capabilityVersion": "0.1.0",
  "provenance": {
    "status": "estimated",
    "producer": "rule:homography-bounce@0.1.0",
    "confidence": 0.4,
    "calibrationRequired": true,
    "calibrationId": "cal-01",
    "benchmarkRef": null
  },
  "status": "proposed",
  "reviewedBy": null,
  "textRef": null
}
