{
  "schemaVersion": "jovra.observation/1",
  "projectId": "sample-court-day",
  "sample": true,
  "eventRevision": 3,
  "observationId": "obs-01",
  "kind": "cue",
  "sourceId": "camera-1",
  "sourceTime": {
    "startUs": 1216000000,
    "endUs": 1218500000
  },
  "sessionTimeUs": 1216000000,
  "syncRevision": 2,
  "eventRef": "p-041",
  "capabilityId": "analysis.serveRhythm",
  "capabilityVersion": "0.1.0",
  "provenance": {
    "status": "estimated",
    "producer": "model:serve-rhythm@0.1.0",
    "confidence": 0.62,
    "calibrationRequired": false,
    "calibrationId": null,
    "benchmarkRef": null
  },
  "status": "proposed",
  "reviewedBy": null,
  "textRef": "text-obs-01"
}
